id,text
26,"Cairns | Corporate giants led by BHP and Qantas are among a flurry of investors pushing to purchase official carbon credits based on a newly approved method that uses coastal wetlands, mangroves, tidal marshes and seagrasses to absorb greenhouse gases. The challenge is finding the right place to do it, says one of the nation's leading experts in the field, Deakin University's Peter Macreadie. ""It's the closest thing you can possibly get to a true offset,"" Professor Macreadie told The Australian Financial Review on Wednesday during a visit to the East Trinity reserve south of Cairns, the site of one of Australia's most successful mangrove remediation projects. Given the scrutiny of offsets in recent months, Professor Macreadie, head of Deakin's blue carbon lab, said there was a need to develop projects that sequestered carbon faster and for longer. ""These are the ecosystems that can put carbon back in the ground for thousands and thousands of years,"" he said, noting that coastal zones were where fossil fuels originate. ""There has been a kind of awakening to the quality of carbon credits even if the market doesn't reward it. ""To paraphrase George Orwell; all carbon is equal, but some carbon is more equal than others. ""A tonne of blue carbon should attract a premium that should be worth 10 times other forms of abatement, in my opinion."" Blue carbon fund It is thought that Australia is home to about 12 per cent of the world's blue carbon ecosystems, and more than 200 years of coastal development has created potential restorable mangrove region the size of Portugal, according to Professor Macreadie. Scientists say blue carbon has the benefit of being able to store carbon at up to 40 times the rate of other vegetation. That feature prompted the federal government to put aside $30 million for a blue carbon fund, with more than half allocated to major coastal restorations. Although voluntary blue carbon credits have been issued overseas, the Australian Emission Reduction Fund approved the first blue carbon method in January. Credits here are yet to be issued. ""Australia is perfectly positioned for a bad reason - because we've drained a lot of our ecosystems and destroyed a lot of them,"" Professor Macreadie said. Their restoration would qualify as a credible source of credits by adding to the store of carbon - meeting the principles of ""additionality"", which is a primary test of such commodities under global rules. ""Many analysts are saying that carbon credits could become one of the world's biggest commodity markets as there are a lot of companies that are trying to reach net zero emissions, and they've included blue carbon in that,"" Professor Macreadie said. ""Whether its Google, or Apple or HSBC and other groups like that, they're really keen for high-quality abatement."" Professor Macreadie said Australia's other advantage was its level of scientific research in the field. ""I think we bat way above our average in terms of our knowledge of these ecosystems and what we could be doing,"" he said. ""And we're also young enough as a country to start to import and co-operate better frameworks, environmental economic accounting frameworks that do start to value ecosystems for more than just carbon, but for all those other things they do for us."" BHP on Thursday announced a $3 million grants program to develop ""shovel-ready"" blue carbon projects. The mining giant is also helping support a CSIRO project to map and estimate the potential CO2 of Australia's blue carbon ecosystems. Restoration is key Restoring coastal wetlands can take many forms, but some are relatively simple, such as restoring tidal flows to spur mangrove growth, or putting up fences to keep out cattle and other ruminants. The challenge is finding the appropriate parcels of land. ""There's so much investor appetite for blue carbon, but there's no supply of projects for them to invest in,"" Professor Macreadie said. ""And some of the reasons [are] social challenges, some governance challenges, some economic challenges, even challenges from a technological point of view about measuring blue carbon at low cost and abatement. ""Fortunately, the new [ERF] method allows that to be done using models, people actually don't need to go in the field and spend a lot of money in measuring that,"" he said during a visit to the East Trinity reserve, a 774-hectare section of mangroves directly across Trinity Inlet from the Cairns CBD. The area was cleared in the early 1970s, levelled and bounded with a seven-kilometre earth wall to plant sugar cane. The changes resulted in a catastrophic surge in sulphuric acids that drained into the Great Barrier Reef, killing fish. In 2000, the Queensland government acquired the land and began one of the world's most successful large-scale acid sulphate soil remediation projects. Next time such a project takes place, there may also be valuable carbon credits attached. The author travelled to Cairns as a guest of the Carbon Market Institute. Classification Language: ENGLISH Publication-Type: Web Publication Subject: WETLANDS (91%); BLUE ECONOMY (90%); CARBON OFFSETS (90%); COASTAL AREAS (90%); EMISSIONS CREDITS (90%); APPROVALS (89%); COLLEGE & UNIVERSITY PROFESSORS (89%); EMERGING MARKETS (89%); EMISSIONS (89%); FRESHWATER ECOSYSTEMS (89%); SALTWATER ECOSYSTEMS (89%); COMMODITIES MARKETS (78%); FUEL MARKETS (78%); GREENHOUSE GASES (78%); POLLUTION MONITORING, PREVENTION & REMEDIATION (78%); SCIENCE & TECHNOLOGY (78%); COASTAL AREA MANAGEMENT (77%); COASTAL CONSERVATION (77%); WETLANDS CONSERVATION (77%); COMMODITIES TRADING (73%); GOVERNMENT & PUBLIC ADMINISTRATION (50%); Climate (%) Company: GOOGLE LLC (50%) Industry: NAICS519130 INTERNET PUBLISHING & BROADCASTING & WEB SEARCH PORTALS (50%); BLUE ECONOMY (90%); CARBON OFFSETS (90%); EMISSIONS CREDITS (90%); COLLEGE & UNIVERSITY PROFESSORS (89%); EMISSIONS (89%); COMMODITIES MARKETS (78%); FUEL MARKETS (78%); ENERGY & UTILITIES (74%); COMMODITIES TRADING (73%) Geographic: AUSTRALIA (95%)"
27,"Costa Rica becomes the first country in Central America and the second in Latin America to restore mangrove ecosystems by rehabilitating, at scale, the hydrological conditions of the area. With the help of Conservation International, Costa Rica becomes the first country in Central America and the second in Latin America and the world to restore mangrove ecosystems by rehabilitating, at scale, the hydrological conditions of the area to allow species to repopulate at a natural rate, creating new economic opportunities for local communities and resource sustainability for the country. The project, led by Conservation International, in conjunction with the National Wetlands Program of the National System of Conservation Areas (SINAC/MINAE), in collaboration with the Tropical Agricultural Research and Higher Education Center (CATIE), and thanks to the support of the Pure Land Foundation, develops actions to rehabilitate the proper tidal inlet in sites within the mangroves of the Estero Puntarenas Wetland and Cipancí National Wildlife Refuge, which were deteriorated or completely transformed into crops. With the entry of the tides through the channels made, the soil will eventually recover the humidity and salinity necessary for the seedlings of the different mangrove species to settle and naturally recover these areas. ""Mangroves are the heroes among the trees, providing a number of vital ecosystem services to society in general and more so to the surrounding coastal communities, yet these forests are often overlooked. For example, they are a protective barrier against storm surges and storms, they filter water coming from the land to the sea, and among their roots more than 80% of species of commercial interest are protected and fed at some point in their lives. In addition, they are blue carbon ecosystems, which by their nature can store up to five times more carbon than mature tropical forests"" emphasizes Ana Gloria Guzman, director of Conservation International Costa Rica. The project is ambitious, based and consolidated on science and research, combining engineering, commitment and work with communities and collaboration with institutions and government. It is positioned as a pilot to be replicated along the coasts of the country and the world. It began with the analysis of historical aerial photographs of the original mangroves, with the objective of identifying the original riverbeds, which were altered for the growth of sugar cane crops, the establishment of salt and shrimp production activities, as well as natural causes. For the rehabilitation, topographic studies were also carried out, as well as studies of the chemical conditions of the soil and the health of the mangrove ecosystem in the area. As of November 2022, around 20,000m of canals have been constructed within the open areas and 1,300m of estuaries have been cleaned and enlarged, including the cleaning of slopes, removal of obstacles in the constructed channels, opening of new channels, as well as cleaning of existing channels. The project incorporates nearby communities in the area such as El Establo, Pitahaya, Níspero and San Buenaventura, including their knowledge about the area, about how this ecosystem used to be before it was modified, and about the conditions that can facilitate its recovery. As Danilo Torres Gómez, CATIE forestry engineer, points out, mangrove restoration is a gradual process: ""First, a baseline study is carried out to learn about the conditions of a nearby reference mangrove, to understand the historical context and carry out carbon sampling, because the project focuses on carbon. At the same time, we are studying the surrounding communities, looking for entities that collaborate with the daily work (opening, canals, cleaning of the sites...) and who, possibly in the future, will help with maintenance and monitoring"". ""The communities near the mangrove forests are those who benefit most directly from their services, but also those who suffer the immediate consequences of the loss of these ecosystems. That is why the project seeks to work hand in hand with the local people, so that they become the true protectors of the mangrove forests and can develop sustainable activities thanks to the conservation and recovery of these ecosystems,"" Guzmán adds. According to the National Wetlands Policy and other current policies, the country has the responsibility to restore mangrove ecosystems. As recently defined, the country has the potential to restore 14,336 hectares of mangroves along the Pacific coast of the country, of which 1,500 hectares are in the Gulf of Nicoya. This project has rehabilitated more than 300 hectares in the Estero Puntarenas Wetland and Cipancí National Refuge, and represents a first, but key, phase of support for the country to reach its national goals. In order to continue strengthening the country's efforts, Conservation International seeks to design and support the implementation of a Blue Carbon Community Development Model. This model, as a variant of the Payment for Ecosystem Services Program - an initiative that was pioneered in its time and has generated wide international recognition for Costa Rica - will allow progress towards achieving the goals in Nationally Determined Contributions (NDCs) assumed by the country as part of the Paris Agreement. ""Costa Rica already monitors mangroves, we have an ecological baseline and we can estimate carbon sequestration. With this we can determine restoration priorities, which is fundamental to be able to report our contributions to the National Greenhouse Gas Inventory"" highlights Jacklyn Rivera, Coordinator of the National Wetlands Program of the National System of Conservation Areas. Classification Language: ENGLISH Publication-Type: Newspaper Journal Code: CENFENG Subject: CONSERVATION (92%); SALTWATER ECOSYSTEMS (91%); COASTAL AREAS (90%); FORESTS & WOODLANDS (90%); FRESHWATER ECOSYSTEMS (90%); LAND RECLAMATION (90%); WETLANDS (90%); WETLANDS CONSERVATION (90%); AGRONOMY (78%); BLUE ECONOMY (78%); FORESTS & WOODLANDS CONSERVATION (78%); LAND CONSERVATION (78%); SUSTAINABILITY (78%); SUSTAINABLE DEVELOPMENT (78%); WILDLIFE (78%); WILDLIFE CONSERVATION (78%); PUBLIC LANDS (77%); AGRICULTURAL RESEARCH (74%); CROP RESEARCH (74%); ENGINEERING (74%); EXPERIMENTATION & RESEARCH (74%); RIVERS (72%); COLLEGES & UNIVERSITIES (54%); Noticias de Hoy (%); costa rica (%); latinoamerica (%); lider (%); manglares (%) Organization: CONSERVATION INTERNATIONAL FOUNDATION (91%) Industry: BLUE ECONOMY (78%); CANALS & WATERWAYS (78%); FORESTS & WOODLANDS CONSERVATION (78%); SUSTAINABLE DEVELOPMENT (78%); AGRICULTURAL RESEARCH (74%); CROP RESEARCH (74%); ENGINEERING (74%); AGRICULTURE (69%); SUGAR CANE FARMING (69%); SUGAR FARMING (69%); AQUACULTURE (64%); COLLEGES & UNIVERSITIES (54%) Geographic: COSTA RICA (94%); LATIN AMERICA (92%); CENTRAL AMERICA (91%)"
28,"(TNSres) -- Deakin University issued the following news release: * * * Researchers at Deakin University's Blue Carbon Lab have commenced trialling the use of biodegradable structures to enhance the growth and survival of coastal wetland species, planted as part of restoration work in Port Phillip Bay and Western Port Bay. * * * The structures, made from potato starch, provide seedlings with protection from high-energy environments without limiting their growth. They break down over time, making way for the established plants to thrive. Coastal wetlands, such as mangrove forests and saltmarshes, provide many benefits including protection from storm surges, and habitat for coastal wildlife. They also store atmospheric carbon, acting as a nature-based solution against climate change. However, coastal wetlands have been degraded and lost around the world and restoring them can be challenging. Dr Stacey Trevathan-Tackett of Deakin University's Blue Carbon Lab says that restoration efforts can be hampered by harsh environmental conditions that damage wetland plants at crucial early stages of their growth and so it's important to constantly come up with new methods to encourage growth. ""We are exploring new ways to help improve the success of restoration and recovery of wetlands,"" Dr Trevathan-Tackett said. ""This includes trialling new and creative techniques in different habitats and conditions, as well as working with local communities along the way."" While mangrove seeds planted into these structures over the summer have started to sprout, researchers want to quantify survival and growth over time and determine how the novel approach is working and to make improvements along the way. The project, titled Regenerating Our Coasts, is a three-year program partnered with Beach Energy that focuses on research and outreach. Beach's CEO Morne Engelbrecht said: ""Beach Energy is proud to partner with Deakin Uni's Blue Carbon Lab to support research to help restore blue carbon ecosystems and accelerate coastal restoration. This is Beach's largest ever environmental partnership and demonstrates our commitment to leaving a positive contribution to communities."" ""With the Regenerating Our Coasts program, we are excited to see seedlings beginning to grow through the structures,"" said Dr Trevathan-Tackett. ""But they have a long way to go, and so do we in terms of trialling different approaches to maximise what this method can do."" Not all coastal wetlands are the same, different environmental conditions, historical impacts, and even the types of plants and animals present influence the restoration success. With such diversity at play, the Blue Carbon Lab team aim to optimise these structures across different wetlands and plant species in Victoria's Port Phillip Bay and Western Port Bay. The trial site in Western Port has enlisted the help of citizen scientists, who will measure both the survival and growth of a batch of mangrove seedlings. The data collected as part of ongoing monitoring will help the researchers further develop restoration approaches at local mangrove sites. ""We see outreach as a vital part of the project,"" said Dr Trevathan-Tackett. ""Engaging with communities through education and knowledge-exchange means that more people understand the problem and support what we're doing to solve it. In turn, by getting involved in citizen science activities, they are contributing to research projects that will ultimately benefit restoration efforts."" To learn more about Regenerating Our Coasts visit https://www.bluecarbonlab.org/facilitated-restoration/ * * * Original text here: https://www.deakin.edu.au/about-deakin/news-and-media-releases/articles/researchers-trial-novel-way-to-restore-coastal-wetlands Contact: Tania Palich, +61 3 924 68554, tania.palich@deakin.edu.au Copyright Targeted News Services MSTRUCK-8114486 MSTRUCK Classification Language: ENGLISH Publication-Type: Newswire Subject: WETLANDS (94%); COASTAL AREAS (92%); BLUE ECONOMY (90%); COASTAL CONSERVATION (90%); CONSERVATION (90%); LAND RECLAMATION (90%); WETLANDS CONSERVATION (90%); LIFE FORMS (89%); POLLUTION & ENVIRONMENTAL IMPACTS (89%); CLIMATE CHANGE (78%); CLIMATOLOGY (78%); COLLEGES & UNIVERSITIES (78%); ANIMALS (77%); ECOSYSTEM CONSERVATION (77%); ECOSYSTEMS & HABITATS (77%); FRESHWATER ECOSYSTEMS (77%); SALTWATER ECOSYSTEMS (77%); SCIENCE & TECHNOLOGY (77%); WILDLIFE (77%); CITIZEN SCIENCE (73%); LEGAL VENUE (73%); ALLIANCES & PARTNERSHIPS (68%) Industry: BLUE ECONOMY (90%); COLLEGES & UNIVERSITIES (78%) Geographic: VICTORIA, AUSTRALIA (74%); AUSTRALIA (79%)"
29,"Grantee:Xiamen City Huli District Green Camp Ecological Civilization Promotion Center  Country:China  Area Of Work:Biodiversity  Grant Amount:US$ 0.00  Co-Financing Cash:US$ 50,000.00  Co-Financing in-Kind:US$ 13,599.25  Project Number:CPR/DLF/BD/2021/08  Status:Not active yet  Baseline information  Zhangjiang Estuary in Fujian is a wetland ecosystem reserve that mainly protects mangrove ecosystem, endangered species and high-quality aquatic germplasm resources in the southeast coasts of China. It is the most diverse and best-developed natural mangrove community on the north of the Tropic of Cancer in China. Mangroves, salt marshes e.g. reed marshes, short-leaf water chestnut saltmarshes were the dominant communities here. Kandelia obovata, Bruguiera gymnorhiza, Avicennia marina are the dominant species.The mangroves here has high natural attributes and typical mangrove community characteristics, so the reserve is of great value for conservation and research and is a treasure of wetland biodiversity.  The local residents in the Zhangjiang Estuary generally take up tidal flat aquaculture, farming, and working out as their main sources of income. There is a close relationship between the residents daily life and mangrove conservation. Tidal flat aquaculturewas an important income for the residents in Zhuta Village, located in the project area. In recent years, the reserve authorities have carried out part of the work of returning ponds to forests. The ongoing education and awareness on mangrove protection helped increasing the rates of returning ponds to forests. Meanwhile, looking for alternative livelihoods and ensuring the lives of residents in the area is also the focus of future protection of local mangrove forests.  Mangroves have ecological functions in terms of sequestering carbon, increasing carbon sinks and mitigating greenhouse gas emissions. Blue carbon has potential significance for the protection, management and restoration of mangroves, and is one of the global strategies curb climate change and global warming. In the global blue carbon voluntary market, there have been eleven mangrove carbon sink trading projects. In September 2021, the first project of blue carbon transaction in Fujian Province of China was successfully completed, based on the ""Mangrove Carbon Sinks Afforestation Methodology"" developed by the applicant, Dr. Luzhen Chen. This transaction is highly market-oriented, which is Clearing invasive Spartina alterniflora and planting mangroves, reflecting the coordination of biological invasion control and mangrove restoration,biodiversity protection and community development. Therefore, mangrove blue carbon trading can become a part of the alternative livelihoods for local communities. The development of future carbon trading models can provide financial support for both the restoration and protection of the mangroves and community development.  At the same time, the youth are the main force to fight against climat Project completion date : 2024-12-31 12:00:00  Major organization : XIAMEN CITY HULI DISTRICT GREEN CAMP ECOLOGICAL CIVILIZATION PROMOTION CENTER  Address : 602, No.52 Hongwen Yili, Siming District, Xiamen City, Fujian, China.  Xiamen  Country :China Email : mg@green -camp.org  Financier : GLOBAL ENVIRONMENT FACILITY SMALL GRANTS PROGRAMME (SGP),  Financier address : GEF Small Grants Programme  Remy Ollier St, Port Louis, Mauritius  +230 213 5384  https://www.thegef.org  No. 2 Liangmahe Nanlu  Beijing, Chaoyang, 100600  Ms. Yi Liu  Phone:  86 10 85320731  Email:  yi.liu@undp.org  Ms. Meijia Lu  Phone:  +861085320743  Email:  meijia.lu@undp.org  Classification Language: ENGLISH Publication-Type: Web Publication Journal Code: 193 Subject: BIODIVERSITY (90%); BLUE ECONOMY (90%); COASTAL AREAS (90%); CONSERVATION (90%); ECOLOGY & ENVIRONMENTAL SCIENCE (90%); FRESHWATER ECOSYSTEMS (90%); PLANT CONSERVATION (90%); SALTWATER ECOSYSTEMS (90%); WETLANDS (90%); CARBON CAPTURE & STORAGE (89%); EMISSIONS CREDITS (89%); BIOLOGY (78%); ENDANGERED SPECIES (78%); FORESTRY & ENVIRONMENT (78%); EMISSIONS (77%); CLIMATE CHANGE (75%); INVASIVE SPECIES (75%); FOREST RESOURCES MANAGEMENT (69%); GLOBAL WARMING (69%); GREENHOUSE GASES (62%) Industry: BLUE ECONOMY (90%); PRESS AGENCY RELEASES (90%); EMISSIONS CREDITS (89%); FORESTRY & ENVIRONMENT (78%); EMISSIONS (77%); FOREST RESOURCES MANAGEMENT (69%); GLOBAL WARMING (69%); AQUACULTURE (66%) Geographic: FUJIAN, CHINA (92%); SOUTH CHINA (73%); CHINA (94%)"
