id,text
94," 27 October 2021 (Antara News) The Indonesian government has set an ambitious target of restoring 600 thousand hectares of mangrove forests across the country by 2024. The world's largest archipelagic country sees the preservation of mangrove forests as crucial because of their role in providing habitats for aquatic and terrestrial fauna and flora, protection from strong winds and waves, soil stabilization and erosion prevention, nutrient retention and water quality improvement through filtration of sediments and pollutants, flood mitigation, sequestration of carbon dioxide, and protection of associated marine ecosystems. As high carbon storage ecosystems, mangrove and peatland ecosystems play a strategic role as nature-based solutions for climate change mitigation and adaptation. Peatlands and mangroves store up to 2 to 10 times more carbon than forests. Given the significant role of mangrove and peatland ecosystems, the government has recently converted the Peatland Restoration Agency (BRG) into Peatland and Mangrove Restoration Agency (BRGM). Mangroves, however, have been disappearing more quickly than inland tropical rainforests, particularly due to clear-cutting for shrimp farms. The loss of mangroves has led to a decline in fisheries, degradation of clean water supply, salinization of coastal soils, erosion and land subsidence, as well as an increase in gas emissions, among other things. President Joko Widodo (Jokowi), while visiting Tana Tidung district, North Kalimantan province, on October 19, 2021 had revealed that the country's existing mangrove forests covered a total area of 3.6 million hectares. Rehabilitation efforts are being undertaken to protect coastal areas from sea waves, seawater intrusion, and preserve the habitat of species, including birds, fishes, crabs, monkeys, and other flora and fauna, living in and around the mangrove forests, according to him. Accompanied by several foreign ambassadors, Widodo planted mangrove trees in North Kalimantan as part of the mangrove restoration program. The program's funds were derived from various sources, including state and regional budgets, Corporate Social Responsibility (CSR) programs of private and state-owned companies, and the community in general, he noted. Earlier, the President had called on regional governments to take a cue from the model of mangrove rehabilitation at Bali's Ngurah Rai Forest Park. Accompanied by the Minister of Environment and Forestry, Siti Nurbaya Bakar, he, on October 8, 2021, visited the forest park to review the implementation of mangrove planting activities. ""We will continue to do this in coastal areas to restore and preserve our mangrove forest areas and also to anticipate and mitigate impacts of global climate change,"" he remarked. The Ngurah Rai Forest Park, which was developed in 2003, is a pilot project for mangrove rehabilitation efforts that combines education and tourism. The park is administratively located in Tanjung Benoa and its surroundings in Kuta and South Kuta sub-districts, Badung district (covering an area of 627 hectares), and in Serangan Island, South Denpasar sub-district, Denpasar city (spanning an area of 746.50 hectares). The mangrove park has abundant natural beauty and biodiversity including bird species, and aquatic species, such as fish, mollusks, and shrimps. The government has emphasized that efforts to control the effects of climate change in the marine and coastal sectors are highly dependent on coastal and marine conservation since coastal ecosystems, such as mangroves and seagrasses, can store and produce carbon, which is better known as blue carbon. Blue carbon is currently considered an important ecosystem since it can absorb greenhouse gas emissions. In fact, Indonesia has vast blue carbon potential on account of the presence of about 3.3 million hectares of mangroves that can store 950 tCO2e of carbon per hectare and about three million hectares of seagrass beds that can store 119.5 tCO2e of carbon per hectare. Hence, the Environment and Forestry Ministry is continuing to encourage the inclusion of blue carbon in the Nationally Determined Contributions (NDC) document considering its potential to store carbon, according to the ministry's director general of climate change control, Laksmi Dwanthi. NDC is an emission reduction contribution document that reflects the commitment of each state party in the Paris Agreement, she explained. Indonesia's blue carbon potential can be found in its large marine area, which contains 23 percent of the world's mangroves ecosystem, she noted. ""It is a very significant area related to the potential carbon absorption, not only in Indonesia but also at the global level,"" she said. Environment and Forestry Minister Siti Nurbaya as well as Maritime Affairs and Fisheries Minister Sakti Wahyu Trenggono have held discussions with experts on assessing how far Indonesia can include the blue carbon potential in the context of climate change mitigation, she added. In the context of adaptation, the ministry has taken various steps and programs to make the policy mainstream, especially in coastal areas, for instance by implementing the Climate Village Program, she informed. In addition, Indonesia has cooperated with other archipelagic countries--Fiji and Costa Rica--to submit a proposal to integrate marine aspects in climate change issues at the UN Climate Change Conference COP25 in 2019, she added. Minister Nurbaya Bakar launched the 2021 National Mangrove Map on October 13, 2021 for the preservation of the country's mangrove forest area. The latest data from the National Mangrove Map shows that Indonesia has 3,364,080 hectares of mangroves, an increase of 52,873 hectares from 3,311,207 hectares in 2013-2019. In the 3,364,080 hectares of mangrove land, there are variations in canopy classification from good to sparse, the minister said. Concerning mangrove lands with sparse canopy to damaged canopy, the government is targeting to recover around 600 thousand hectares by 2024, she added. Nurbaya reaffirmed the government's commitment to mangrove preservation efforts by successfully transforming fishponds into mangrove ecosystems again. As for the 2021 mangrove rehabilitation program's target of restoring 34 thousand hectares of mangroves, the BRGM is upbeat that it can be achieved. Head of BRGM, Hartono, said that the agency will continue to plant mangroves in nine provinces: North Sumatra, Bangka Belitung, Riau Islands, Riau, West Kalimantan, East Kalimantan, North Kalimantan, Papua, and West Papua. ""In order to expedite mangrove rehabilitation, we are also involving local residents through the labor-intensive method, so that the mangrove planting target can quickly be achieved,"" he informed. The government hopes that the program will benefit people by improving their standard of living and purchasing power, thus making them prosperous. In addition, the program is also expected to support efforts to accelerate economic recovery post-COVID-19. Classification Language: English US Publication-Type: Web Publication Subject: FORESTS & WOODLANDS (91%); BLUE ECONOMY (90%); ECOSYSTEMS & HABITATS (90%); EROSION (90%); PLANT CONSERVATION (90%); SALTWATER ECOSYSTEMS (90%); WETLANDS (90%); ANIMALS (89%); CLIMATE CHANGE (89%); COASTAL AREAS (89%); LIFE FORMS (89%); COMPANY ACTIVITIES & MANAGEMENT (78%); ENVIRONMENTAL DEPARTMENTS (78%); EROSION CONTROL (78%); FORESTRY & ENVIRONMENT (78%); GOVERNMENT & PUBLIC ADMINISTRATION (78%); MARINE CONSERVATION (78%); REGIONAL & LOCAL GOVERNMENTS (78%); SHELLFISH FARMING (78%); WATER RESOURCES (78%); CARBON CAPTURE & STORAGE (77%); EMISSIONS (77%); NEGATIVE ENVIRONMENTAL NEWS (77%); POLLUTION & ENVIRONMENTAL IMPACTS (76%); WATER POLLUTION (76%); ENVIRONMENT & NATURAL RESOURCES (73%); GOVERNMENT ADVISORS & MINISTERS (73%); RAIN FORESTS (73%); SOCIETY, SOCIAL ASSISTANCE & LIFESTYLE (73%); WATER QUALITY (72%); WATER SUPPLY (71%); BUSINESS ETHICS & CORPORATE CITIZENSHIP (66%); CORPORATE SOCIAL RESPONSIBILITY (66%); ESG FACTORS - SOCIAL (61%); STATE OWNED BUSINESSES (61%); EMBASSIES & CONSULATES (50%) Industry: BLUE ECONOMY (90%); FORESTRY & ENVIRONMENT (78%); LOGGING INDUSTRY (78%); MARINE CONSERVATION (78%); SHELLFISH FARMING (78%); EMISSIONS (77%); BUDGETS (72%); AQUACULTURE (67%) Person: JOKO WIDODO (89%) Geographic: INDONESIA (98%); BORNEO (79%)"
95,"2022 AUG 01 (NewsRx) -- By a News Reporter-Staff News Editor at Ecology Daily News -- Current study results on ecosystem health and sustainability have been published. According to news reporting out of Xiamen University by NewsRx editors, research stated, ""Sequestration of blue carbon (C) in mangrove plantations depends on site characteristics and plantation management.""   Financial supporters for this research include Fundamental Research Funds For The Central Universities; The Scientific And Technological Research Project For Social Welfare of Zhongshan City of China.   Our news editors obtained a quote from the research from Xiamen University: ""This study evaluated the effects of plantation management on C sequestration at a C-neutral site in Xiamen, China. A field study was conducted on 10-year-old Sonneratia apetala and Kandelia obovata plantations (mono-Sa, mono-Ko) and a 15-year-old mixed plantation (mix-SK). We found that mono-Ko had a significantly higher ecosystem C sequestration rate (3.32±0.62 kg C m-2 yr-1) than others when planted in the indirect shade of pioneer species. As a non-native species, Sonneratia performed better (0.57±0.01 kg C m-2 yr-1) when planted with Kandelia than in monotypic plantations. The temporary and long-term certified emission reduction (tCER and lCER) of the mono-Ko was 17876.74 and 16089.07 net CO2-e, respectively, making up 59.32% and 58.48% of the total tCER and lCER of the plantation site. A literature review was conducted to show the compatibility of this study with other natural and plantation sites of China and Bangladesh (the native habitat for Sonneratia).""   According to the news editors, the research concluded: ""The C sequestration of Sonneratia plantation sites in China is comparable (0.086%) with those in Bangladesh. However, the soil C accumulation rate for a Sonneratia monotypic plantation in Bangladesh decreased with age, yet the same did not occur in the plantations of China.""   For more information on this research see: Blue Carbon Sequestration Following Mangrove Restoration: Evidence From a Carbon Neutral Case in China. Ecosystem Health and Sustainability, 2022. The publisher for Ecosystem Health and Sustainability is Taylor & Francis Group.   A free version of this journal article is available at https://doi.org/10.1080/20964129.2022.2101547.   Our news journalists report that additional information may be obtained by contacting Sourav Bagchi Ratul, State Key Laboratory of Marine Environmental Science, Key Laboratory of the Ministry of Education for Coastal and Wetland Ecosystems, College of the Environment and Ecology, Xiamen University, Xiamen, Fujian 361102, People's Republic of Chi Additional authors for this research include Xiaoxuan Gu, Peiyang Qiao, Febrina Wulanda Sagala, Shu Nan, Nazrul Islam, Luzhen Chen.   Keywords for this news article include: Xiamen University, Asia, China, Ecosystem Health and Sustainability, Sustainability Research.   Our reports deliver fact-based news of research and discoveries from around the world. Copyright 2022, NewsRx LLC  Classification Language: ENGLISH Document-Type: Editor's Choice Publication-Type: Newsletter Subject: EXPERIMENTATION & RESEARCH (91%); RESEARCH REPORTS (91%); CARBON CAPTURE & STORAGE (90%); COLLEGES & UNIVERSITIES (90%); ECOLOGY & ENVIRONMENTAL SCIENCE (90%); JOURNALISM (90%); SALTWATER ECOSYSTEMS (90%); SUSTAINABILITY (90%); WETLANDS CONSERVATION (90%); BLUE ECONOMY (89%); ECOSYSTEMS & HABITATS (89%); FRESHWATER ECOSYSTEMS (89%); PLANT CONSERVATION (89%); ENVIRONMENTAL RESEARCH (79%); SCIENCE & TECHNOLOGY (79%); SOCIETY, SOCIAL ASSISTANCE & LIFESTYLE (79%); WETLANDS (79%); NEWS REPORTING (78%); RESEARCH & DEVELOPMENT (78%); WRITERS (78%); EMISSIONS (77%); POLLUTION MONITORING, PREVENTION & REMEDIATION (77%); EDUCATION DEPARTMENTS (72%); LIFE FORMS (71%); Asia;China;Ecosystem Health and Sustainability;Sustainability Research (%) Company: TAYLOR & FRANCIS GROUP LTD (51%) Industry: COLLEGES & UNIVERSITIES (90%); BLUE ECONOMY (89%); NEWS REPORTING (78%); PUBLISHING (78%); WRITERS (78%); EMISSIONS (77%) Geographic: SOUTH CHINA (79%); FUJIAN, CHINA (73%); CHINA (97%); BANGLADESH (93%); ASIA (79%)"
96,"2023 MAR 08 (NewsRx) -- By a News Reporter-Staff News Editor at Climate Change Daily News -- New research on climate change is the subject of a new report. According to news originating from Terengganu, Malaysia, by NewsRx editors, the research stated, ""Mangroves play a crucial role in maintaining the stability of coastal regions, particularly in the face of climate change.""   The news correspondents obtained a quote from the research from University of Malaysia Terengganu: ""To gain insight into associations between climate change and mangroves, we conducted bibliometric research on the global indexed database of the Web of Knowledge, Core Collection. A total of 4458 literature were analyzed based on bibliometric information and article metadata through a scientometric analysis of citation analysis as well as a cluster analysis. Results suggest that coastal countries such as the USA, Australia, China, India, and Brazil are showing the recent influential mangrove-related keywords such as blue carbon and carbon stock.""   According to the news reporters, the research concluded: ""Interestingly, the “carbon stock”, “Saudi Arabia”, “range expansion” and “nature-based flood risk mitigation” is among the top cluster networks in the field of climate change and mangrove forest. The present research is expected to attract potential leaders in research, government, civil society, and business to advance progress towards mangrove sustainability in the changing climate meaningfully.""   For more information on this research see: Mapping the Link between Climate Change and Mangrove Forest: A Global Overview of the Literature. Forests, 2023,14(2). (Forests - http://www.mdpi.com/journal/forests/). The publisher for Forests is MDPI AG.   A free version of this journal article is available at https://doi.org/10.3390/f14020421.   Our news editors report that more information may be obtained by contacting Thirukanthan Chandra Segaran, Institute of Marine Biotechnology (IMB), University of Malaysia Terengganu (UMT), Kuala Nerus 21030, Terengganu, Malaysia. Additional authors for this research include Mohamad Nor Azra, Fathurrahman Lananan, Juris Burlakovs, Zane Vincevica-Gaile, Vita Rudovica, Inga Grinfelde, Nur Hannah Abd Rahim, Behara Satyanarayana.   ORCID is an identifier for authors and includes bibliographic information. The following is ORCID information for the authors of this research: Thirukanthan Chandra Segaran (orcid.org/0000-0002-2234-0415), Mohamad Nor Azra (orcid.org/0000-0001-9333-9270), Juris Burlakovs (orcid.org/0000-0003-0269-4790), Zane Vincevica-Gaile (orcid.org/0000-0003-2868-0434), Inga Grinfelde (orcid.org/0000-0002-3220-1777), Nur Hannah Abd Rahim (orcid.org/0000-0001-8710-3843), Behara Satyanarayana (orcid.org/0000-0003-4191-2607).   Keywords for this news article include: University of Malaysia Terengganu, Terengganu, Malaysia, , Climate Change, Global Warming.   Our reports deliver fact-based news of research and discoveries from around the world. Copyright 2023, NewsRx LLC  Classification Language: ENGLISH Document-Type: Expanded Reporting Publication-Type: Newsletter Subject: CLIMATE CHANGE (90%); CLIMATOLOGY (90%); EXPERIMENTATION & RESEARCH (90%); COLLEGES & UNIVERSITIES (89%); WRITERS (89%); JOURNALISM (78%); BLUE ECONOMY (76%); INFORMATION SCIENCE (75%); BIOTECHNOLOGY & GENETIC SCIENCE (73%); COASTAL AREAS (71%); SOCIETY, SOCIAL ASSISTANCE & LIFESTYLE (70%); MARINE BIOTECHNOLOGY (67%); Climate Change;Global Warming (%) Industry: COLLEGES & UNIVERSITIES (89%); WRITERS (89%); BLUE ECONOMY (76%); PHARMACEUTICALS & BIOTECHNOLOGY (73%); METADATA MANAGEMENT (72%); MARINE BIOTECHNOLOGY (67%) Geographic: MALAYSIA (94%); AUSTRALIA (79%); BRAZIL (79%); CHINA (79%); INDIA (77%)"
97,"2022 AUG 12 (NewsRx) -- By a News Reporter-Staff News Editor at NewsRx Science Daily -- Investigators discuss new findings in marine science. According to news originating from Beihai, People's Republic of China, by NewsRx correspondents, research stated, ""Mangroves are considered to be a sink for microplastics (MPs) due to their unique characteristics.""   Our news journalists obtained a quote from the research from Ministry of Natural Resources: ""Previous studies mainly focused on the spatial distribution of MPs, but few researchers have addressed the influence of tidal variation on this distribution, especially since the MP total number in mangroves was unknown. In this study, surface sediment samples were collected in mangroves from the Beibu Gulf, South China Sea, and the abundance, composition, and number of MPs were investigated. The results showed that MPs were widely present in all mangrove sediment samples, with abundances ranging from 26.67 ± 9.43 to 239.94 ± 37.80 items/kg. The distribution of MPs was heterogeneous among different sampling sites, with the highest levels in the Shankou (SK) area. The MP abundance in the same mangrove forest gradually increased from the low tidal zone to the high tidal zone, with the enrichment factor ranging from 1.50 to 4.00. The MP abundance was significantly correlated with particulate organic carbon (POC) (n = 12, R = 0.664, p < 0.05).""   According to the news reporters, the research concluded: ""Results showed that mangroves had an interception effect on MPs and factors affecting MP distribution in mangrove sediments included not only tides but also human activities, such as aquaculture, agriculture, and residential life. Finally, this paper estimated the MP total number in mangroves at different sampling areas and tidal zones, and the middle tidal zone was considered to be more accurate for MP pollution assessment in mangroves.""   For more information on this research see: Tidal variation shaped microplastic enrichment patterns in mangrove blue carbon ecosystem of northern Beibu Gulf, China. Frontiers in Marine Science, 2022,9. (Frontiers in Marine Science - http://www.frontiersin.org/Marine_Science). The publisher for Frontiers in Marine Science is Frontiers Media S.A.   A free version of this journal article is available at https://doi.org/10.3389/fmars.2022.927884.   Our news editors report that additional information may be obtained by contacting Li Zhang, Guangxi Key Laboratory of Beibu Gulf Marine Resources, Environment and Sustainable Development, Fourth Institute of Oceanography, Ministry of Natural Resources, Beihai, People's Republic of China. Additional authors for this research include Shujia Wang, Qiying Jian, Peng Zhang, Yejin Lu, Haoqi Liu. Our reports deliver fact-based news of research and discoveries from around the world. Copyright 2022, NewsRx LLC  Classification Language: ENGLISH Document-Type: Expanded Reporting Publication-Type: Newsletter Subject: OCEANOGRAPHY (92%); BIOLOGY (90%); BLUE ECONOMY (90%); EARTH & ATMOSPHERIC SCIENCE (90%); EXPERIMENTATION & RESEARCH (90%); INVESTIGATIONS (90%); MARINE BIOLOGY (90%); RESEARCH REPORTS (90%); SALTWATER ECOSYSTEMS (90%); COASTAL AREAS (89%); ENVIRONMENT & NATURAL RESOURCES (89%); JOURNALISM (89%); NATURAL RESOURCES (89%); NATURAL RESOURCES MANAGEMENT (89%); MARINE CONSERVATION (78%); MARINE RESOURCES MANAGEMENT (78%); WRITERS (78%); SUSTAINABILITY (75%); SUSTAINABLE DEVELOPMENT (75%); SUSTAINABLE FORESTRY (71%); POLLUTION & ENVIRONMENTAL IMPACTS (70%); Asia;China;Marine Science;Science (%) Company: BEIBU GULF TOURISM CORP LTD (92%); SEA LTD (56%) Ticker: SE (NYSE) (56%) Industry: NAICS561520 TOUR OPERATORS (92%); SIC4725 TOUR OPERATORS (92%); NAICS519130 INTERNET PUBLISHING & BROADCASTING & WEB SEARCH PORTALS (56%); BLUE ECONOMY (90%); MARINE CONSERVATION (78%); MARINE RESOURCES MANAGEMENT (78%); WRITERS (78%); SUSTAINABLE DEVELOPMENT (75%); SUSTAINABLE FORESTRY (71%); AQUACULTURE (50%) Geographic: GUANGXI, CHINA (88%); PACIFIC OCEAN (79%); SOUTH CHINA SEA (79%); SOUTH CHINA (74%); CHINA (94%); TAIWAN (92%); ASIA (79%)"
98,"2022 OCT 10 (NewsRx) -- By a News Reporter-Staff News Editor at NewsRx Science Daily -- Researchers detail new data in geography. According to news reporting originating from the University Gadjah Mada by NewsRx correspondents, research stated, ""Mangroves can store carbon effectively with a value of about 1,023 Mg C/Ha and become one of the richest forests that store 4-20 billion tons of blue carbon globally. Remote sensing imagery can be used to map mangrove surface carbon stocks using radar and optical image sensors.""   Our news correspondents obtained a quote from the research from University Gadjah Mada: ""Generally, forest carbon on earth is stored in two places, namely above the surface (Above Ground Carbon, AGC) and below the surface (Below Ground Carbon, BGC). This study aims to estimate the surface carbon stock of mangroves using multisensory imagery using the Random Forest method in the Clungup Mangrove Conservation (CMC) area, Malang Regency, East Java. Four vegetation indices (IRECI, NDI45, NDVI, SAVI), single band, and VV VH polarization were used as predictive variables. Estimating the carbon stock mangrove value using Sentinel-1 imagery produced 2,126 tons of C with R² 0.11. Meanwhile, Sentinel-2 produces an estimated carbon value of 2,025 tons C with an R² of 0.22. The estimation model using Sentinel-2 shows a better evaluation value with a Root Mean Squared Error (RMSE) of 0.89 and a Mean Absolute Error (MAE) of 0.75.""   According to the news reporters, the research concluded: ""The IRECI vegetation index is the most important variable in estimating carbon stocks. The results of the mapping accuracy of the Sentinel-1 model show a value of 34.73% and Sentinel-2 35.03%.""   For more information on this research see: Mapping Mangrove Surface Carbon Stocks Using Multisensor Imagery in Clungup Mangrove Conservation (Cmc) Malang Regency. Jurnal Geografi, 2022,14(2):192-201. (Jurnal Geografi - http://jurnal.unimed.ac.id/2012/index.php/geo). The publisher for Jurnal Geografi is Universitas Negeri Medan.   A free version of this journal article is available at https://doi.org/10.24114/jg.v14i2.33575.   Our news editors report that more information may be obtained by contacting Maulana Abdul Hakim, Universitas Gadjah Mada.   Keywords for this news article include: University Gadjah Mada, Geography, Science.   Our reports deliver fact-based news of research and discoveries from around the world. Copyright 2022, NewsRx LLC  Classification Language: ENGLISH Document-Type: Editor's Choice Publication-Type: Newsletter Subject: COLLEGES & UNIVERSITIES (90%); EXPERIMENTATION & RESEARCH (90%); FINANCIAL MARKET UPDATES (90%); GEOGRAPHY (90%); JOURNALISM (90%); NEWS REPORTING (90%); PLANT CONSERVATION (90%); WETLANDS CONSERVATION (90%); RESEARCH REPORTS (89%); FORESTS & WOODLANDS (76%); Geography;Science (%) Industry: COLLEGES & UNIVERSITIES (90%); FINANCIAL MARKET UPDATES (90%); NEWS REPORTING (90%); REMOTE SENSING TECHNOLOGY (79%); ELECTRONIC SENSORS & DETECTORS (71%) Geographic: INDONESIA (57%)"
