id,text
58,"The Indonesian government has set an ambitious target of restoring 600 thousand hectares of mangrove forests across the country by 2024. The world's largest archipelagic country sees the preservation of mangrove forests as crucial because of their role in providing habitats for aquatic and terrestrial fauna and flora, protection from strong winds and waves, soil stabilization and erosion prevention, nutrient retention and water quality improvement through filtration of sediments and pollutants, flood mitigation, sequestration of carbon dioxide, and protection of associated marine ecosystems. As high carbon storage ecosystems, mangrove and peatland ecosystems play a strategic role as nature-based solutions for climate change mitigation and adaptation. Peatlands and mangroves store up to 2 to 10 times more carbon than forests. Given the significant role of mangrove and peatland ecosystems, the government has recently converted the Peatland Restoration Agency (BRG) into Peatland and Mangrove Restoration Agency (BRGM). Mangroves, however, have been disappearing more quickly than inland tropical rainforests, particularly due to clear-cutting for shrimp farms. The loss of mangroves has led to a decline in fisheries, degradation of clean water supply, salinization of coastal soils, erosion and land subsidence, as well as an increase in gas emissions, among other things. President Joko Widodo (Jokowi), while visiting Tana Tidung district, North Kalimantan province, on October 19, 2021 had revealed that the country's existing mangrove forests covered a total area of 3.6 million hectares. Rehabilitation efforts are being undertaken to protect coastal areas from sea waves, seawater intrusion, and preserve the habitat of species, including birds, fishes, crabs, monkeys, and other flora and fauna, living in and around the mangrove forests, according to him. Accompanied by several foreign ambassadors, Widodo planted mangrove trees in North Kalimantan as part of the mangrove restoration program. The program's funds were derived from various sources, including state and regional budgets, Corporate Social Responsibility (CSR) programs of private and state-owned companies, and the community in general, he noted. Earlier, the President had called on regional governments to take a cue from the model of mangrove rehabilitation at Bali's Ngurah Rai Forest Park. Accompanied by the Minister of Environment and Forestry, Siti Nurbaya Bakar, he, on October 8, 2021, visited the forest park to review the implementation of mangrove planting activities. ""We will continue to do this in coastal areas to restore and preserve our mangrove forest areas and also to anticipate and mitigate impacts of global climate change,"" he remarked. The Ngurah Rai Forest Park, which was developed in 2003, is a pilot project for mangrove rehabilitation efforts that combines education and tourism. The park is administratively located in Tanjung Benoa and its surroundings in Kuta and South Kuta sub-districts, Badung district (covering an area of 627 hectares), and in Serangan Island, South Denpasar sub-district, Denpasar city (spanning an area of 746.50 hectares). The mangrove park has abundant natural beauty and biodiversity including bird species, and aquatic species, such as fish, mollusks, and shrimps. The government has emphasized that efforts to control the effects of climate change in the marine and coastal sectors are highly dependent on coastal and marine conservation since coastal ecosystems, such as mangroves and seagrasses, can store and produce carbon, which is better known as blue carbon. Blue carbon is currently considered an important ecosystem since it can absorb greenhouse gas emissions. In fact, Indonesia has vast blue carbon potential on account of the presence of about 3.3 million hectares of mangroves that can store 950 tCO2e of carbon per hectare and about three million hectares of seagrass beds that can store 119.5 tCO2e of carbon per hectare. Hence, the Environment and Forestry Ministry is continuing to encourage the inclusion of blue carbon in the Nationally Determined Contributions (NDC) document considering its potential to store carbon, according to the ministry's director general of climate change control, Laksmi Dwanthi. NDC is an emission reduction contribution document that reflects the commitment of each state party in the Paris Agreement, she explained. Indonesia's blue carbon potential can be found in its large marine area, which contains 23 percent of the world's mangroves ecosystem, she noted. ""It is a very significant area related to the potential carbon absorption, not only in Indonesia but also at the global level,"" she said. Environment and Forestry Minister Siti Nurbaya as well as Maritime Affairs and Fisheries Minister Sakti Wahyu Trenggono have held discussions with experts on assessing how far Indonesia can include the blue carbon potential in the context of climate change mitigation, she added. In the context of adaptation, the ministry has taken various steps and programs to make the policy mainstream, especially in coastal areas, for instance by implementing the Climate Village Program, she informed. In addition, Indonesia has cooperated with other archipelagic countries--Fiji and Costa Rica--to submit a proposal to integrate marine aspects in climate change issues at the UN Climate Change Conference COP25 in 2019, she added. Minister Nurbaya Bakar launched the 2021 National Mangrove Map on October 13, 2021 for the preservation of the country's mangrove forest area. The latest data from the National Mangrove Map shows that Indonesia has 3,364,080 hectares of mangroves, an increase of 52,873 hectares from 3,311,207 hectares in 2013-2019. In the 3,364,080 hectares of mangrove land, there are variations in canopy classification from good to sparse, the minister said. Concerning mangrove lands with sparse canopy to damaged canopy, the government is targeting to recover around 600 thousand hectares by 2024, she added. Nurbaya reaffirmed the government's commitment to mangrove preservation efforts by successfully transforming fishponds into mangrove ecosystems again. As for the 2021 mangrove rehabilitation program's target of restoring 34 thousand hectares of mangroves, the BRGM is upbeat that it can be achieved. Head of BRGM, Hartono, said that the agency will continue to plant mangroves in nine provinces: North Sumatra, Bangka Belitung, Riau Islands, Riau, West Kalimantan, East Kalimantan, North Kalimantan, Papua, and West Papua. ""In order to expedite mangrove rehabilitation, we are also involving local residents through the labor-intensive method, so that the mangrove planting target can quickly be achieved,"" he informed. The government hopes that the program will benefit people by improving their standard of living and purchasing power, thus making them prosperous. In addition, the program is also expected to support efforts to accelerate economic recovery post-COVID-19. Source: ANTARA News Classification Language: ENGLISH Publication-Type: Wire Subject: FORESTS & WOODLANDS (91%); BLUE ECONOMY (90%); ECOSYSTEMS & HABITATS (90%); EROSION (90%); FORESTS & WOODLANDS CONSERVATION (90%); PLANT CONSERVATION (90%); SALTWATER ECOSYSTEMS (90%); WETLANDS (90%); WETLANDS CONSERVATION (90%); ANIMALS (89%); CLIMATE CHANGE (89%); COASTAL AREAS (89%); COASTAL CONSERVATION (89%); LIFE FORMS (89%); COMPANY ACTIVITIES & MANAGEMENT (78%); ENVIRONMENTAL DEPARTMENTS (78%); EROSION CONTROL (78%); FORESTRY & ENVIRONMENT (78%); GOVERNMENT & PUBLIC ADMINISTRATION (78%); MARINE CONSERVATION (78%); REGIONAL & LOCAL GOVERNMENTS (78%); SHELLFISH FARMING (78%); WATER RESOURCES (78%); CARBON CAPTURE & STORAGE (77%); EMISSIONS (77%); NEGATIVE ENVIRONMENTAL NEWS (77%); POLLUTION MONITORING, PREVENTION & REMEDIATION (77%); POLLUTION & ENVIRONMENTAL IMPACTS (76%); ENVIRONMENT & NATURAL RESOURCES (73%); GOVERNMENT ADVISORS & MINISTERS (73%); RAIN FORESTS (73%); SOCIETY, SOCIAL ASSISTANCE & LIFESTYLE (73%); WATER QUALITY (73%); WATER SUPPLY (71%); BUSINESS ETHICS & CORPORATE CITIZENSHIP (66%); CORPORATE SOCIAL RESPONSIBILITY (66%); ESG FACTORS - SOCIAL (61%); STATE OWNED BUSINESSES (61%); EMBASSIES & CONSULATES (50%) Industry: BLUE ECONOMY (90%); FORESTS & WOODLANDS CONSERVATION (90%); FORESTRY & ENVIRONMENT (78%); LOGGING INDUSTRY (78%); MARINE CONSERVATION (78%); SHELLFISH FARMING (78%); EMISSIONS (77%); BUDGETS (72%); AQUACULTURE (67%) Person: JOKO WIDODO (88%) Geographic: INDONESIA (96%); BORNEO (79%)"
59,"Jakarta, Feb. 11 -- The Ministry of Maritime Affairs and Fisheries (KKP) is collaborating with Seychelles, a country in the Indian Ocean region, to broaden the scope of knowledge regarding blue carbon to support a blue economy. ""It aims to strengthen the blue economy and provide additional knowledge on Blue Carbon, Blue Bond, and Marine Protected Areas,"" Head of the Maritime and Fisheries Research and Human Resources Agency (BRSDM) I Nyoman Radiarta said in a written statement here on Saturday. ""The collaboration is also to emphasize the importance of sustainable management of marine and fishery resources,"" he further stated. Radiarta remarked that for implementing this collaboration, the Training on Trainers (ToT) on the Blue Economy Program was held and was attended by 700 participants in a hybrid format. This activity is a series of collaborations between the ministry and the Seychelles that had been initiated since 2021. He expressed optimism that this activity would be able to raise public awareness on the importance of sustainable management of fisheries resources by applying the blue economy concept and developing creativity and innovation. Radiarta explained that the collaboration aims to ensure the sustainability of fisheries ecosystems in Indonesia and encourage equitable economic distribution in coastal areas. Collaboration is also aimed at boosting the competitiveness of fishery products in the global market and can be a solution to climate issues by maintaining the blue carbon ecosystem. Blue carbon is a reserve of emissions absorbed, stored, and released by coastal and marine ecosystems. In Indonesia, Blue Carbon is spread in coastal ecosystems, such as mangrove forests, seagrass beds, and peatlands in coastal areas. Published by HT Digital Content Services with permission from Antara News. For any query with respect to this article or any other content requirement, please contact Editor at contentservices@htlive.com Classification Language: ENGLISH Publication-Type: Newswire Subject: BLUE ECONOMY (95%); BLUE GROWTH (90%); GREEN ECONOMY (90%); MARINE ADMINISTRATION (90%); MARINE RESOURCES MANAGEMENT (90%); OCEAN ECONOMY (90%); SALTWATER ECOSYSTEMS (90%); SUSTAINABLE DEVELOPMENT (90%); SUSTAINABLE FISHERIES (90%); COASTAL AREAS (89%); MARINE BIOLOGY (89%); SUSTAINABLE FORESTRY (89%); BIOLOGY (78%); MARINE CONSERVATION (78%); OCEANOGRAPHY (78%); WETLANDS (76%); HUMAN RESOURCES & PERSONNEL MANAGEMENT (72%) Industry: BLUE ECONOMY (95%); BLUE GROWTH (90%); GREEN ECONOMY (90%); MARINE RESOURCES MANAGEMENT (90%); PRESS AGENCY RELEASES (90%); SUSTAINABLE DEVELOPMENT (90%); SUSTAINABLE FISHERIES (90%); SUSTAINABLE FORESTRY (89%); MARINE CONSERVATION (78%); MEDIA CONTENT (63%) Geographic: JAKARTA, INDONESIA (89%); INDONESIA (93%)"
60,"Indonesia and Singapore are preparing to work together on a research project on carbon captured and stored by coastal and marine ecosystems.  Findings from the blue carbon project could help Indonesia estimate how much carbon dioxide it can capture and meet its emission reduction targets.  The pilot project will be carried out on Setokok Island in Riau province as soon as the end of this year or early next year, said Dr Kus Prisetiahadi, assistant to the deputy for climate change and disaster management at the Coordinating Ministry for Maritime Affairs and Investment.  Setokok Island, one of the locations of a government-run mangrove rehabilitation programme, was chosen because of its potential blue carbon, the size of its mangrove forests and the variety of its mangroves, Dr Kus said.  ""Indonesia and Singapore are designing a concept note that will serve as guidelines for the research,"" he told The Straits Times.  The project follows a bilateral agreement signed in March and covers collaborations on sustainability and climate change.  Over the years, Indonesia has lost a vast span of mangroves - which can store around four times more carbon dioxide than trees - primarily due to abrasion and land use changes. Its mangrove ecosystems total 3.36 million hectares, and potential areas to rehabilitate come to more than 756,000ha.  Riau province is among nine of 34 provinces prioritised by the Indonesian Peatland and Mangrove Restoration Agency for its mangrove rehabilitation programme.  Indonesia has a potentially huge amount of blue carbon, especially from mangrove and seagrass, that may reach 3.57 billion tonnes of carbon dioxide equivalent, or 17 per cent of the world's carbon, but it is still largely untapped.  Dr Kus said research and technology would be key in maximising the utilisation of the sizeable carbon potential to support economic growth, enhance coastal resilience and mitigate the impact of climate change. ""It is expected that through this research, Indonesia can calculate its potential carbon more accurately by way of advanced technology at the lowest costs possible,"" he said.  A mangrove rehabilitation programme, that may run together with the research on the island, is also expected to drive local economic growth and provide coastal protection, he added.  The project will involve experts from both countries, including those from Indonesia's National Research and Innovation Agency, Bogor Agricultural University and the National University of Singapore (NUS).  Professor Koh Lian Pin, director of NUS Centre for Nature-based Climate Solutions, told ST the university has been exploring opportunities for research collaboration on nature-based solutions with its counterparts in South-east Asia.  ""For example, there are opportunities to leverage technology to improve our estimates of the carbon stocks and sequestration rates of mangrove forests and other coastal ecosystems,"" he said. ""This research could help unlock the potential of nature-based solutions for climate change mitigation.""  Dr Kus said the research will also pave the way towards a carbon sharing scheme between Indonesia and Singapore. But there are no talks so far pertaining to carbon offset as part of the partnership. Classification Language: ENGLISH Publication-Type: Newspaper Subject: BLUE ECONOMY (90%); CARBON CAPTURE & STORAGE (90%); RESEARCH & DEVELOPMENT (90%); SALTWATER ECOSYSTEMS (90%); WETLANDS CONSERVATION (90%); CLIMATE CHANGE (89%); CLIMATOLOGY (89%); COASTAL AREAS (89%); COASTAL CONSERVATION (89%); EMERGING MARKETS (89%); FORESTS & WOODLANDS (88%); AGREEMENTS (78%); ALLIANCES & PARTNERSHIPS (78%); COLLABORATIVE RESEARCH & DEVELOPMENT (78%); CONSERVATION (78%); EMISSIONS (78%); ISLANDS & REEFS (78%); MARINE ADMINISTRATION (78%); MARINE RESOURCES MANAGEMENT (78%); NEGATIVE ENVIRONMENTAL NEWS (78%); POLLUTION MONITORING, PREVENTION & REMEDIATION (78%); SUSTAINABLE DEVELOPMENT (78%); WETLANDS (78%); INTERNATIONAL RELATIONS & NATIONAL SECURITY (75%); LAND USE & DEVELOPMENT (75%); PLANT CONSERVATION (75%); ENVIRONMENTAL REGULATION & POLICY (73%); SAFETY, ACCIDENTS & DISASTERS (73%); AIR QUALITY REGULATION (72%); LAND USE PLANNING (72%); INTERNATIONAL RELATIONS (69%); ECONOMY & ECONOMIC INDICATORS (62%); COLLEGE & UNIVERSITY PROFESSORS (60%); HOLDING COMPANIES (58%) Industry: BLUE ECONOMY (90%); EMISSIONS (78%); MARINE RESOURCES MANAGEMENT (78%); SUSTAINABLE DEVELOPMENT (78%); LAND USE PLANNING (72%); COLLEGE & UNIVERSITY PROFESSORS (60%) Geographic: SUMATRA, INDONESIA (92%); INDONESIA (95%); SINGAPORE (95%); ASIA (92%); SOUTH-EASTERN ASIA (92%)"
61,"The Indonesian government has teamed up with a local mining company to plant 30,000 mangrove seedlings and releasing 20,000 clams in North Sumatra, as the government earmarked the region as an ideal area for mangrove restoration. The Ministry of Environment and Forestry partnered with Agincourt Resources on World Wetlands Day to plant the seedlings across a 10-hectare area in the Central Tapanuli region along the west coast of Sumatra, which features a coastline stretching some 200 kilometres. We appreciate all parties for this mangrove planting action, hopefully it wont be the last. We hope that there will continue to be support and also other innovations regarding the protection of the sea coast, said Dasrul Chaniago, director of pollution control and coastal and marine damage at the Ministry of Environment and Forestry. The government said rehabilitating and conserving mangrove ecosystems would help Indonesia achieve its Nationally Determined Contribution (NDC) under the Paris Agreement. Ruli Tanio, deputy president director of Agincourt Resources, said in a statement that planting mangroves could create new economic opportunities for the local communities through ecotourism and sustainable fishing. The company operates the Martabe gold mine in North Sumatra, roughly 30 km from its western coast. We are a mining company whose operational area is not close to the coast. However, we are aware that mangrove forest is a source for protecting aquatic ecosystems between land, coast, and sea with major biological, physical, and economic functions for survival, Tanio said. The company partnered with local farming group Hutan Mandiri Lestari to cultivate the mangrove seedlings, which comprised of local Rhizophora seeds aged 4-6 months that reach a height of 50-80 centimetres. The clam seeds meanwhile were of the locust species, according to the company. Planting is expected to occur over the next 2-3 months, and will be nurtured over two years, with the potential to be extended. The cost and source of funding for the project was not disclosed by Agincourt Resources or the Indonesian government. Based on Indonesias 2021 national mangrove map, the country has an existing mangrove area of some 3.3 million hectares. Unfortunately, Indonesia is losing a significant number of these forests, Dasrul told the Jakarta Post. A 2021 study, conducted by researchers from Singaporean and Indonesian universities, estimated that some 14.1 MtCO2e of carbon emissions were released between 1985-2020 in Indonesia as a result of mangroves forests being converted into coconut plantations. These amounts were almost four and 21 times higher than emissions from land clearing and aquaculture, respectively, as a substantial soil carbon loss occurs as a result of the mangroves being ripped up and replaced with coconuts plantations, according to the study. Our findings imply that improved coastal land management with the avoidance of future mangrove loss is urgently required in order to support national efforts for reducing carbon emissions from the land sector, the study concluded. The government aims to rehabilitate some 600,000 ha of mangroves by 2024, and has mapped around 77,000 ha of land that feature the most suitable conditions. Indra Exploitasia, the Environment and Forestry ministrys biodiversity conservation director, said reforestation was part of the governments contribution to biodiversity loss targets as part of the UNs Convention on Biological Diversity. The Indonesian government has highlighted it efforts preserve seagrass and mangroves as part of its climate change policy to both reduce emissions and improve biodiversity outcomes, and to improve its blue carbon potential. Classification Language: ENGLISH Publication-Type: Magazine Journal Code: 1846 Subject: COASTAL AREAS (90%); ENVIRONMENTAL DEPARTMENTS (90%); FORESTRY & ENVIRONMENT (90%); FRESHWATER ECOSYSTEMS (90%); SALTWATER ECOSYSTEMS (90%); WETLANDS CONSERVATION (90%); COASTAL CONSERVATION (89%); EMISSIONS (89%); FORESTS & WOODLANDS (89%); NATURAL RESOURCES MANAGEMENT (89%); POLLUTION MONITORING, PREVENTION & REMEDIATION (89%); AGREEMENTS (78%); ALLIANCES & PARTNERSHIPS (78%); LAND USE & DEVELOPMENT (78%); NATURAL RESOURCES (78%); NEGATIVE NEWS (78%); PLANT CONSERVATION (78%); POLLUTION & ENVIRONMENTAL IMPACTS (78%); NEGATIVE ENVIRONMENTAL NEWS (77%); POLLUTION (77%); SUSTAINABLE DEVELOPMENT (77%); WETLANDS (77%); CLIMATE ACTION (75%); GREENHOUSE GASES (74%); BUSINESS OPERATIONS (73%); SUSTAINABLE FISHERIES (73%); ECOTOURISM (72%); RESEARCH REPORTS (62%) Industry: MINING & EXTRACTION (92%); FORESTRY & ENVIRONMENT (90%); FORESTRY & LOGGING (90%); MINES & MINING (90%); EMISSIONS (89%); COCONUT & COIR PRODUCTION (78%); SUSTAINABLE DEVELOPMENT (77%); SUSTAINABLE FISHERIES (73%); ECOTOURISM (72%); FRUITS & VEGETABLES (69%); AQUACULTURE (50%) Geographic: SUMATRA, INDONESIA (93%); INDONESIA (98%)"
62,"SINGAPORE: An international institute that will help protect and restore coastal marine ecosystems across Southeast Asia and beyond will be set up in Singapore. The International Blue Carbon Institute, established by Amazon and Conservation International, was launched on Monday (Nov 14) at the COP27 summit in Egypt. Blue carbon is the carbon stored in coastal and marine ecosystems, such as mangroves and tidal marshes. These ecosystems store large quantities of carbon in both the plants and the sediment below and are recognised as an essential part of the solution to global climate change. ""Southeast Asia, with its vast stretches of mangroves and coastal ecosystems, has tremendous potential for blue carbon initiatives that will also support environmental protection, biodiversity conservation and livelihoods and heritage of local communities,"" said Minister for Sustainability and the Environment Grace Fu at the launch. Working with partners across the region, the institute will build the capacity needed to accelerate and scale up efforts to protect and restore the coastal marine ecosystem, she added. Southeast Asia holds more than one-third of the world's mangrove forests, said Amazon in a press release, adding that the greatest loss of mangrove forests is also in this region. ""In Asia through to the Pacific Islands, coastal communities are increasingly vulnerable to sea-level rise and stronger storms. Blue carbon ecosystems fortify communities against climate effects while providing fresh water, supporting biodiversity, and other natural benefits,"" said Amazon. The institute will serve as a knowledge hub to build capacity, expertise, standards and methodology to develop and scale projects, Amazon added. It will also work with governments across Southeast Asia and beyond to ""integrate blue carbon into climate change mitigation policies"". ""To realise this potential, we need enablers. First, we need to develop the methodologies, tools and scientific research to quantify its benefits,"" said Ms Fu. ""Second, countries need to build up the human capacity to design, develop and implement high-quality blue carbon projects. Third, we need partnerships among stakeholders, in academia, policy, philanthropy, in the region to scale these solutions, and unlock opportunities."" The institute will expand education for practitioners, policymakers and communities to access the latest scientific knowledge, standards, best practices, and resources on blue carbon projects. It will also partner with academic institutions, non-governmental organisations, the private sector and governments, said Amazon. In the first year, the institute will focus on building tools to support the science-based restoration of blue carbon ecosystems, develop key guidance on blue carbon in Nationally Determined Contributions and expand the knowledge related to the climate value of seagrasses and kelp ecosystems. Amazon will provide a grant of up to US$3 million (S$4.1 million) to establish and fund the institute's operations for the first three years. ""Singapore is excited to partner Conservation International on this momentous initiative, made possible with the support of Singapore's Economic Development Board, Amazon and other partners,"" said Ms Fu. Conservation International will lead the institute. ""We look forward to working with like-minded partners to collectively advance global climate ambition and action to create a better climate future for future generations,"" Ms Fu added. INITIAL: st(mi) Classification Language: ENGLISH Publication-Type: Transcript Subject: COASTAL AREAS (94%); SALTWATER ECOSYSTEMS (94%); CONSERVATION (92%); BIODIVERSITY (90%); BLUE ECONOMY (90%); COASTAL CONSERVATION (90%); FRESHWATER ECOSYSTEMS (90%); MARINE CONSERVATION (90%); CLIMATE CHANGE (89%); CLIMATOLOGY (89%); MARINE BIOLOGY (89%); CLIMATE CHANGE REGULATION & POLICY (78%); EDUCATION SYSTEMS & INSTITUTIONS (78%); ENVIRONMENT & NATURAL RESOURCES (78%); ENVIRONMENTALISM (78%); ISLANDS & REEFS (78%); LAND RECLAMATION (78%); SUSTAINABILITY (78%); SUSTAINABLE DEVELOPMENT (78%); WETLANDS (78%); BEST PRACTICES (75%); NONGOVERNMENTAL ORGANIZATIONS (72%); SEA LEVEL CHANGES (70%); ASSOCIATIONS & ORGANIZATIONS (69%); EXPERIMENTATION & RESEARCH (69%); PUBLIC POLICY (68%); SCIENCE FUNDING (67%); SCIENCE & TECHNOLOGY (62%); GRANTS & GIFTS (60%); PHILANTHROPY (60%) Organization: CONSERVATION INTERNATIONAL FOUNDATION (84%) Industry: BLUE ECONOMY (90%); MARINE CONSERVATION (90%); EDUCATION SYSTEMS & INSTITUTIONS (78%); SUSTAINABLE DEVELOPMENT (78%); EDUCATIONAL SERVICES (73%) Geographic: ASIA (94%); SOUTH-EASTERN ASIA (94%); SINGAPORE (92%); EGYPT (79%)"
