id,text
1,"NEARLY £75 million will be invested in schemes to protect the world's oceans, the Government has said. Environment Secretary Therese Coffey made the announcement at the Our Ocean conference in Panama this week, where heads of state and the private sector discussed ways to protect the marine environment. Ms Coffey said £45 million will go towards a new ""Blue Tech Superhighway"" project, which aims to build collaboration between communities in Africa and Asia who would develop and share technologies to help fisheries become more climate resilient and less damaging to the oceans. The UK will also contribute £24million to the Global Fund for Coral Reefs and has become the first donor to the Blue Carbon Action Partnership, by offering £4million. The partnership is a collection of intergovernmental organisations, state ministries, environmental groups and scientists seeking to build stronger ""blue carbon"" ecosystems and economies. Blue carbon ecosystems are coastal environments with plants that remove carbon dioxide from the atmosphere - such as mangrove trees, salt marshes and seagrass - which together are present on every continent on Earth except Antarctica. Ocean conservation groups have welcomed the news, but said the UK must strengthen the protection of marine areas at home and improve its relationships with developing countries to ensure that international negotiations to safeguard the oceans are successful. Ms Coffey said: ""It is almost impossible to overstate the importance of stepping up our efforts to bolster the resilience of the marine environment and, in turn, the economies and communities that depend on it. ""At the UN nature summit in Montreal, we made a commitment to manage our whole ocean sustainably and set a target to protect at least 30% of the world's ocean by 2030. ""The UK is leading, co-leading, and supporting global coalitions of ambition to drive forward this mission, and I urge countries to come together to deliver coordinated, impactful action on the ground."" The funding announcements will be drawn from the £154million Climate and Ocean Adaptation and Sustainable Transition programme (Coast) launched by Lord Goldsmith at the UN Ocean Conference in 2022. Hugo Tagholm, executive director of Oceana UK, said: ""We welcome the UK's international work to tackle illegal fishing and also to fund some marine conservation initiatives globally, but this must be matched by action back home."" However, Megan Randles, Greenpeace UK political campaigner, said: ""These funds are pitiful and from an existing pot. ""Countries are in the final, critical, hours of talks at the UN to agree a Global Ocean Treaty - a once-in-a-lifetime opportunity - but after Coffey's announcement this morning, you could be forgiven for wondering if the minister is even aware those negotiations are taking place."" Graphic   Therese Coffey. Classification Language: ENGLISH Publication-Type: Newspaper Journal Code: HDM Subject: OCEANS (93%); BLUE ECONOMY (90%); CONSERVATION (90%); ENVIRONMENTAL & WILDLIFE ORGANIZATIONS (90%); FRESHWATER ECOSYSTEMS (90%); GOVERNMENT ADVISORS & MINISTERS (90%); MARINE CONSERVATION (90%); MARINE RESOURCES MANAGEMENT (90%); SALTWATER ECOSYSTEMS (90%); COASTAL AREAS (89%); CONFERENCES & CONVENTIONS (89%); MARINE BIOLOGY (89%); OCEAN HEALTH (89%); UNITED NATIONS (86%); INTERNATIONAL RELATIONS & NATIONAL SECURITY (79%); ENVIRONMENT & NATURAL RESOURCES (78%); ENVIRONMENTALISM (78%); FOREIGN INVESTMENT (78%); INTERNATIONAL GOVERNMENTAL ORGANIZATIONS (78%); ISLANDS & REEFS (78%); WETLANDS (78%); WILDLIFE CONSERVATION (78%); INTERGOVERNMENTAL TALKS (77%); ASSOCIATIONS & ORGANIZATIONS (76%); SUSTAINABLE DEVELOPMENT (75%); HEADS OF STATE & GOVERNMENT (74%); DEVELOPING COUNTRIES (71%); EXECUTIVES (63%) Industry: BLUE ECONOMY (90%); MARINE CONSERVATION (90%); MARINE RESOURCES MANAGEMENT (90%); FISHING REGULATION & POLICY (75%); SUSTAINABLE DEVELOPMENT (75%) Geographic: EARTH (92%); UNITED KINGDOM (96%); AFRICA (79%); ANTARCTICA (79%); ASIA (79%); National Edition"
2,"Cologny: World Economic Forum has issued the following press release: Restoring coastal ecosystems could result in a return of $11.8 billion in carbon finance by 2040.While private sector actors increasingly demand carbon credit investments, the blue carbon credit supply is still lacking.The World Economic Forum launched the Blue Carbon Action Partnership to support national ambitions and drive the blue carbon market.Coastal wetlands – consisting of mangroves, seagrasses, and salt marshes – play a critical role in climate change mitigation and adaptation. These are estimated to sequester 4 to 10 tons of carbon dioxide per hectare annually and up to 10 times faster than tropical rainforests. Globally, coastal ecosystems contribute over $ 190 billion annually to blue carbon wealth. Financing their restoration could result in 380 million TCO2 of sequestration and a return of $11.8 billion in carbon finance by 2040. This is equivalent to the annual emissions of nearly 82 million gasoline-powered passenger vehicles. It is unsurprising then that blue carbon is reaching the attention of leaders at the highest level, with the UN Secretary-General Executive Office flagging it as a top priority for ocean work in 2023 and G20 leaders visiting a mangrove forest during their summit in Bali. While private sector actors increasingly demand carbon credit investments to protect or restore blue ecosystems, the supply of these credits is lacking, leaving the opportunities for blue carbon untapped. Additionally, current policy frameworks around carbon markets lack clarity which has slowed down the development of blue carbon projects. DISCOVERWhat's the World Economic Forum doing about the ocean? Show more Beyond market opportunities, governments can use blue carbon to achieve their mitigation and adaptation goals under the Paris Agreement, but the commitments for conservation investment have not materialised at scale. As blue carbon gains more attention, only partnerships will produce progress. To fully realise its potential, the world must unite blue carbon actors at all levels to develop the science, policy, and financial mechanisms for scaling blue carbon ecosystem restoration and conservation. Have you read?How to follow Davos 2023From Davos 2022 to Davos 2023: The six themes then that have set the agenda nowHere are four ways local, national, and global stakeholders can work together for the future of blue carbon: 1) Invest in high-quality carbon projects Corporations are increasingly committing to net-zero objectives and even considering carbon offsets, substantially boosting the demand for blue carbon credits. Current carbon credit inventories are shrinking, and competition among corporate offset purchasers is high. On that account, new blue carbon projects can generate hundreds of thousands of credits to meet this growing demand. Nevertheless, we must ensure that the credits are grounded in credible science and that there are safeguards with equitable benefit sharing for communities. New frameworks are emerging to help both buyers and suppliers understand what projects ensure benefits for people and the planet. The High-Quality Blue Carbon Principles and Guidance released at UNFCCC COP 27, for example, provide a consistent and accepted approach to these objectives. 2) Give local leaders and communities access to the international market Many communities may already value their blue carbon ecosystems for fishing, livelihood, shoreline protection, and other benefits. Carbon, as an additional benefit, can unlock external finance opportunities for these ecosystems on top of their daily lived benefits. We can unlock high-integrity capital investment in blue carbon ecosystems by providing local communities access to the voluntary carbon market. This requires collaboration across communities, support organizations, and policy-makers to make access to markets easier for projects. DISCOVERWhat's the World Economic Forum doing about mangroves? Show more 3) Equip governments to achieve their Paris Agreement climate goals As countries begin to renew their Nationally Determined Contributions (NDCs) outlining how they will achieve their goals under the Paris Agreement, many are including blue carbon in their NDCs for adaptation and mitigation. Deliberate national policies, regulations, and accounting approaches are needed to help these governments and those who have yet to include blue carbon in their NDCs to achieve such ambitions. Because blue carbon ecosystems span land and ocean, jurisdiction over these ecosystems can be confusing and policies challenging. Government support to clarify land tenure will streamline approaches to mainstreaming blue carbon. 4) Global partnerships Significant ambitions to achieve investment goals in blue carbon are also building, including the newly launched Mangrove Breakthrough. This partnership between the UN Climate Change High-Level Champions and the Global Mangrove Alliance aims to uncover $4 billion to secure the future of 15 million hectares of mangroves globally by 2030. Through collective action, the Mangrove Breakthrough project seeks to halt mangrove loss, restore half of the recent losses, double the protection globally, and ensure sustainable long-term finance for all existing mangroves. The International Partnership for Blue Carbon is another prime example. As a group of governments, non-governmental organizations, and research organizations, they aim to connect efforts across all members and leverage the great work already happening to support one another. In parallel, using the High-Quality Blue Carbon Principles and Guidance as a foundational document, the World Economic Forum will soon launch the Blue Carbon Action Partnership (BCAP). BCAP supports national blue carbon ambitions and convenes partners to help tackle international challenges and drive the blue carbon market forward. Partnerships at all levels – from local to global, across all sectors – will allow us to unlock blue carbon ecosystems' potential to benefit people, biodiversity, and the planet. Classification Language: ENGLISH Publication-Type: Newswire Journal Code: INS Subject: COASTAL AREAS (91%); SALTWATER ECOSYSTEMS (91%); BLUE ECONOMY (90%); CARBON OFFSETS (90%); COASTAL CONSERVATION (90%); CONSERVATION (90%); ECONOMY & ECONOMIC INDICATORS (90%); ECOSYSTEM CONSERVATION (90%); EMISSIONS CREDITS (90%); FRESHWATER ECOSYSTEMS (90%); LAND RECLAMATION (90%); MARINE CONSERVATION (90%); WETLANDS (90%); INTERNATIONAL ECONOMIC ORGANIZATIONS (89%); AGREEMENTS (78%); CLIMATE ACTION (78%); CLIMATE CHANGE REGULATION & POLICY (78%); EMISSIONS (78%); OUTPUT & DEMAND (78%); SCIENCE POLICY (78%); SCIENCE & TECHNOLOGY (75%); PRESS RELEASES (73%); UNITED NATIONS (70%); RAIN FORESTS (69%); BUSINESS REPORTS & FORECASTS (56%) Industry: BLUE ECONOMY (90%); CARBON OFFSETS (90%); EMISSIONS CREDITS (90%); MARINE CONSERVATION (90%); EMISSIONS (78%)"
3,"Cologny: World Economic Forum has issued the following press release: Coastal and marine ecosystems can store up to five times as much carbon per acre as tropical rainforests.Blue carbon credits invest in the protection of these systems, preserving the natural world while also reducing or preventing carbon emissions.The World Economic Forum ’ s Friends of Ocean Action, Salesforce and others have produced the High-Quality Blue Carbon Principles & Guidance to ensure that blue carbon stakeholders are engaging the market effectively and with integrity.Coastal and marine ecosystems such as mangrove forests, seagrass meadows and salt marshes can store, on average, more carbon per acre than terrestrial forests — but they have only recently emerged as a resource for generating carbon credits. Investing in blue carbon projects and credits will help protect these unique aquatic ecosystems — an end in itself — but also ensure the vast quantities of carbon they have sequestered from the atmosphere stays under water. If the world is to meet the ambitious goals of the Paris Climate Agreement and limit global warming to 1.5 °C or achieve the UN ’ s Sustainable Development Goals, blue carbon cannot be ignored. Have you read?What are blue carbon credits and how to maximise their impactMapping Blue Carbon Wealth Around the WorldWhy the future of carbon should be blueThe growing market for blue carbonDemand for blue carbon credits currently far outweighs supply and care must be taken to ensure that the growth of the growth of blue carbon is driven by principles and guidance that optimise outcomes for people, biodiversity and the climate. For this reason, Salesforce, the World Economic Forum ’ s Friends of Ocean Action, the Ocean Risk and Resilience Action Alliance (ORRAA), The Nature Conservancy and Conservation International, together with the Meridian Institute, have facilitated the creation of the High-Quality Blue Carbon Principles & Guidance. This framework, developed through an open and global consultative process, builds on and codifies existing best practices and provides a roadmap to maximise the potential of blue carbon. The international carbon market consists of carbon credits and offsets that represent avoided emissions or removed carbon — or its equivalent — from the atmosphere. The global carbon market is expanding rapidly and could grow to $50 – 100 billion by 2030, but has come under scrutiny due to poor project design and allegations of greenwashing. However, the climate crisis has reached such urgency that we need all available climate action simultaneously, including carbon credits, as a ‘last, but not later ’ investment. Companies and individuals can and should invest in high-quality carbon credits to help fulfill their net-zero ambitions. The climate crisis has reached such urgency that we need all available climate action simultaneously, including carbon credits as a ‘last, but not later ’ investment. Salesforce has outlined this important decision-making process in a recent blog underpinning its new Net Zero Marketplace. It has taken 20 years after the 1997 Kyoto Protocol kicked off the carbon market for the very first blue carbon credits to be issued — but now blue carbon is garnering the attention it deserves. Five principles for effective blue carbon Image: Meridian InstituteFive principles for effective blue carbonCompanies can play an important role in scaling the supply of high-quality blue carbon credits to help fulfil their net-zero and nature positive ambitions. With increased interest and investment in this market comes a timely opportunity for blue carbon stakeholders to align on a shared definition of high-quality blue carbon projects and credits and how to engage the market responsibly. The following five principles, each of equal importance, along with the subsequent guidance are foundational to the development and deployment of high-quality blue carbon projects and credits. 1. Safeguard nature.Blue carbon projects provide unique opportunities to preserve and enhance ecosystem resilience. Conversely, the destruction of blue carbon ecosystems often leads to a significant loss of biodiversity and the release of hundreds of years of emissions that had been sequestered under water. While market demand often prefers restoration, stakeholders should also prioritize the conservation of current ecosystems. 2. Empower people.Most blue carbon projects take place where people live and work. Blue carbon stakeholders must implement social safeguards to protect and enhance community member rights, knowledge and leadership and foster equitable access to the global carbon market. 3. Employ the best information, interventions and carbon accounting practices.The integrity of the voluntary carbon market hinges, in part, on the quality of information used to design projects and communicate the resulting carbon value of the credits generated. Purchasers, investors, suppliers, project developers and governments must use the most appropriate interventions and the best available scientific knowledge, including indigenous, traditional and local knowledge. DISCOVERWhat's the World Economic Forum doing about mangroves? Show more 4. Operate locally and contextually.Blue carbon ecosystems are incredibly heterogeneous with respect to their role in local customs, gender and power dynamics, resource use, management and ownership regimes and social, policy and governance structures. Project design should account for the social and ecological context as well as the local implications of international policies. 5. Mobilise high-integrity capital.High-quality blue carbon requires fair and transparent pricing and compensation that supports sustainable financing. Buyers should set science-based targets for limiting global average temperature increase to 1.5°C and compensate for any remaining emissions with high-quality carbon credits. One example of a high-quality blue carbon project is an innovative mangrove project in Cispata, Columbia, led by Conservation International and local NGOs with funding from Apple. The “Vida Manglar” project was the first blue carbon project to enter the international carbon market with its carbon fully calculated. The “Vida Manglar” project was the first to calculate how much carbon was stored in this Cispata mangrove forest. Image: Conservation InternationalThe future of blue carbonBlue carbon holds immense potential not only for decarbonization efforts, but also because of the wealth of co-benefits to communities and ecosystems. For example, mangroves support fish and other biodiversity which in turn support livelihoods and tourism, and provide coastal defences against floods. As carbon markets become bluer, the world must design and invest in blue carbon projects and credits that cause a shift towards greater accountability, equity and transparency. The High-Quality Blue Carbon Principles & Guidance is one resource that can help blue carbon stakeholders engage the market with integrity. Implementing and learning from these principles and guidance will unleash the full potential of blue carbon, cutting emissions while protecting some of the earth ’ s most unique and valuable ecosystems — and the people that rely on them. Classification Language: ENGLISH Publication-Type: Newswire Journal Code: INS Subject: SALTWATER ECOSYSTEMS (91%); BLUE ECONOMY (90%); CARBON OFFSETS (90%); COASTAL AREAS (90%); EMISSIONS CREDITS (90%); FORESTS & WOODLANDS (90%); RAIN FORESTS (90%); CLIMATE ACTION (89%); CLIMATE CHANGE (89%); CONSERVATION (89%); EMISSIONS (89%); NEGATIVE ENVIRONMENTAL NEWS (89%); BEST PRACTICES (78%); BIODIVERSITY (78%); ECOSYSTEM CONSERVATION (78%); ENVIRONMENTAL & WILDLIFE ORGANIZATIONS (78%); LAND CONSERVATION (78%); SUSTAINABILITY (78%); SUSTAINABLE DEVELOPMENT (78%); WETLANDS (78%); WILDLIFE CONSERVATION (78%); FRESHWATER ECOSYSTEMS (77%); GREENWASHING (77%); NATURAL RESOURCES CONSERVATION (77%); AGREEMENTS (73%); CLIMATE CHANGE REGULATION & POLICY (73%); PRESS RELEASES (73%); SUSTAINABLE DEVELOPMENT GOALS (73%); GLOBAL WARMING (72%); GREENHOUSE GASES (72%); UNITED NATIONS (67%) Industry: BLUE ECONOMY (90%); CARBON OFFSETS (90%); EMISSIONS CREDITS (90%); EMISSIONS (89%); SUSTAINABLE DEVELOPMENT (78%); GREENWASHING (77%); SUSTAINABLE DEVELOPMENT GOALS (73%); GLOBAL WARMING (72%)"
4,"Saltmarsh ecosystems are protecting more than 88,000 homes from storm surges and are sequestering carbon at a rapid rate, according to the Australian Bureau of Statistics. The data was released as part of the federal government's National Ocean Ecosystem Account, which showed the marshes sequestered about 10 million tonnes of carbon dioxide in 2021. In the past saltmarshes and mangrove swamps have been viewed as wastelands with little economic value. But their ability to absorb eight times as much carbon at 35 times the rate of ""land-based"" forests, according to Local Land Services (LLS), is one of the factors driving the effort to save them. The agency is working with farmers to fence off saltmarshes on private land. Fences up Shoalhaven dairy farmer Paul Anderson says he enjoys having a mix of wetlands and productive pastures on his Pyree property. ""This place here is about 200 acres … probably about 80 acres of it is saltmarsh,"" he said. ""The saltmarsh is pretty low country and you can't make any feed or silage off it, so it's just a holding paddock for cows. ""If we can beautify it a bit more, that's good — because we do have a bit of a wetland area with a few birds there and water all the time."" Mr Anderson and his brother Keith are working with LLS to fence off 17 hectares. About 80 per cent of the area is saltmarsh. The remaining 20 per cent is made up of mangroves and swamp oak forest. LLS senior land services officer Sonia Bazzacco said there was funding available to help farmers fence off key saltmarsh areas. ""This is a really large significant area that the Andersons are putting aside towards having an environmental gain,"" she said. ""I've been approaching a lot of farmers in Pyree, because there's actually 220 hectares of saltmarsh in the Shoalhaven. ""That's the largest area of saltmarsh in the whole of south-east New South Wales."" Key habitats Threats to coastal salt marsh include development, uncontrolled livestock, the rising sea level and mangrove incursion. ""The first step really is to exclude stock off these very sensitive areas,"" Ms Bazzacco said. Saltmarshes are a key breeding habitat for fish, birds and crustaceans. It has been estimated that mangrove-related species in eastern Australia account for about 67 per cent of the entire commercial catch. Recently saltmarshes and mangroves have attracted more funding for restoration work as countries around the world look to invest in a blue carbon strategy. ""A lot of people don't realise is that coastal saltmarsh is able to absorb eight times as much carbon [at] 35 times the rate than a land-based forest,"" Ms Bezzacco said. ""It's also very important in improving water quality. ""The saltmarsh acts as a buffer between the terrestrial and aquatic environment. ""Sediment and farm run-off, such as nitrogen and contaminants, are actually filtered through and absorbed and recycled by the saltmarsh."" Earlier this year the Albanese government invested $9.5 million to support five new practical restoration blue carbon projects. Environment and Water Minister Tanya Plibersek said in a statement that saltmarshes also protected homes. ""Over 19,000 kilometres of our coastline are being protected from storm surge by mangrove and saltmarsh ecosystems,"" she said. ""If these were lost it would cost over $225 billion to replace their coastal protection services with seawalls. ""This new data clearly shows how important they are and how many of us living along the coast of Australia benefit [from their protection], possibly without even realising."" Classification Language: ENGLISH Publication-Type: Web Publication Subject: SALTWATER ECOSYSTEMS (92%); CARBON CAPTURE & STORAGE (90%); COASTAL CONSERVATION (90%); ECOSYSTEM CONSERVATION (90%); FRESHWATER ECOSYSTEMS (90%); NATURAL RESOURCES MANAGEMENT (90%); STATISTICS (90%); WETLANDS (90%); WETLANDS CONSERVATION (90%); COASTAL AREAS (89%); ECOSYSTEMS & HABITATS (89%); FORESTS & WOODLANDS (89%); BLUE ECONOMY (78%); GOVERNMENT STATISTICS AGENCIES (78%); MAMMALS (78%); GOVERNMENT & PUBLIC ADMINISTRATION (77%); CRUSTACEANS (73%); SEA LEVEL CHANGES (72%); WATER QUALITY (71%); COMMERCIAL FISHING (60%); Rural:Agricultural Systems and Practice:Livestock:Dairy Production (%); Environment:Environmental Management (%); Rural:Pasture (%); Environment:Wetlands (%); Australia:NSW:Bega (%); Australia:NSW:Wollongong (%); Australia:NSW:Pyree (%) Industry: FARMERS & RANCHERS (90%); BLUE ECONOMY (78%); DAIRY FARMING (78%); LIVESTOCK (78%); COMMERCIAL FISHING (60%) Geographic: NEW SOUTH WALES, AUSTRALIA (94%); AUSTRALIA (98%)"
